{
  "event_id": "evt_0",
  "occurred_at": "2026-10-10T12:00:00Z",
  "organization_id": "org_1",
  "actor": {
    "principal_id": null,
    "auth_method": "operator"
  },
  "action": "organization.create",
  "targets": {
    "organization_id": "org_1"
  },
  "outcome": "succeeded",
  "correlation_id": "c-0"
}
